[
  {
    "id": "stockintelli",
    "slug": "stockintelli",
    "name": "🦅 股市智投",
    "brandName": "StockIntelli",
    "summary": "AI 智能全週期看盤：自動生成盤前策略、盤中觀點與盤後整理，並整合台股排行榜、法人動向與貪婪指數等關鍵籌碼數據，一站式精準掌握市場節奏。",
    "description": "AI 智能全週期看盤：自動生成盤前策略、盤中觀點與盤後整理，並整合台股排行榜、法人動向與貪婪指數等關鍵籌碼數據，一站式精準掌握市場節奏。 社群共鳴與資產管理：同步市場熱門討論、投資文章與即時財經新聞，並提供自選清單、投資組合損益與持股分析功能，全方位打造並掌握個人投資宇宙",
    "categories": [
      "research"
    ],
    "useCases": [
      "希望透過 AI 觀點與關鍵籌碼數據輔助，快速掌握台股市場節奏的投資人。",
      "需要一站式整合市場動態、社群討論並高效管理個人投資組合的交易者。"
    ],
    "markets": [],
    "assetClasses": [],
    "analysisTypes": [],
    "pricing": "unknown",
    "requiresLogin": "unknown",
    "language": [],
    "mobileSupport": "unknown",
    "dataSources": [],
    "updateFrequency": "unknown",
    "status": "pending-verification",
    "lastVerifiedAt": "2026-08-04",
    "verifiedBy": "PRStK Lab A03 baseline migration",
    "features": [
      "AI 智能全週期看盤：自動生成盤前策略、盤中觀點與盤後整理，並整合台股排行榜、法人動向與貪婪指數等關鍵籌碼數據，一站式精準掌握市場節奏。",
      "社群共鳴與資產管理：同步市場熱門討論、投資文章與即時財經新聞，並提供自選清單、投資組合損益與持股分析功能，全方位打造並掌握個人投資宇宙"
    ],
    "limitations": [
      "尚未完成逐項服務驗證，使用前請以外部服務最新說明為準。"
    ],
    "targetUsers": [
      "希望透過 AI 觀點與關鍵籌碼數據輔助，快速掌握台股市場節奏的投資人。",
      "需要一站式整合市場動態、社群討論並高效管理個人投資組合的交易者。"
    ],
    "tags": [
      "台股",
      "選股",
      "法人",
      "技術分析",
      "市場情緒"
    ],
    "aliases": [
      "AI選股",
      "台股看盤",
      "法人動向",
      "市場排行"
    ],
    "url": "https://www.stockintelli.com/",
    "screenshots": [],
    "relatedTools": [],
    "relatedResearch": [],
    "riskNotice": "外部服務內容可能延遲或變更，不構成投資建議。",
    "featured": true
  },
  {
    "id": "novaweave",
    "slug": "novaweave",
    "name": "🧠 智慧產業地圖",
    "brandName": "NovaWeave",
    "summary": "視覺化供應鏈與市場熱力圖：透過互動式節點圖完整呈現產業上下游結構，並以熱力圖讓投資人一眼看出盤面資金集中的板塊與輪動方向。",
    "description": "視覺化供應鏈與市場熱力圖：透過互動式節點圖完整呈現產業上下游結構，並以熱力圖讓投資人一眼看出盤面資金集中的板塊與輪動方向。 深度產業研究與 AI 輔助：整合三大法人、大戶及 ETF 籌碼動向，並提供涵蓋數十個主題的產業資料庫與 AI 一鍵生成摘要、法說會重點解讀。",
    "categories": [
      "explore"
    ],
    "useCases": [
      "希望以「機構等級」視角，有邏輯地看清台股供應鏈與產業脈絡的投資人。",
      "需要快速掌握每日資金流向、追蹤法人動向，並系統化研究新題材的交易者。"
    ],
    "markets": [],
    "assetClasses": [],
    "analysisTypes": [],
    "pricing": "unknown",
    "requiresLogin": "unknown",
    "language": [],
    "mobileSupport": "unknown",
    "dataSources": [],
    "updateFrequency": "unknown",
    "status": "pending-verification",
    "lastVerifiedAt": "2026-08-04",
    "verifiedBy": "PRStK Lab A03 baseline migration",
    "features": [
      "視覺化供應鏈與市場熱力圖：透過互動式節點圖完整呈現產業上下游結構，並以熱力圖讓投資人一眼看出盤面資金集中的板塊與輪動方向。",
      "深度產業研究與 AI 輔助：整合三大法人、大戶及 ETF 籌碼動向，並提供涵蓋數十個主題的產業資料庫與 AI 一鍵生成摘要、法說會重點解讀。"
    ],
    "limitations": [
      "尚未完成逐項服務驗證，使用前請以外部服務最新說明為準。"
    ],
    "targetUsers": [
      "希望以「機構等級」視角，有邏輯地看清台股供應鏈與產業脈絡的投資人。",
      "需要快速掌握每日資金流向、追蹤法人動向，並系統化研究新題材的交易者。"
    ],
    "tags": [
      "台股",
      "產業研究",
      "產業輪動",
      "資金流",
      "法人"
    ],
    "aliases": [
      "供應鏈地圖",
      "產業熱力圖",
      "板塊輪動",
      "產業分析"
    ],
    "url": "https://aistockmap.com",
    "screenshots": [],
    "relatedTools": [],
    "relatedResearch": [],
    "riskNotice": "外部服務內容可能延遲或變更，不構成投資建議。",
    "featured": false
  },
  {
    "id": "tideflow",
    "slug": "tideflow",
    "name": "🧭 潮汐資金流",
    "brandName": "TideFlow",
    "summary": "視覺化資金輪動：透過板塊泡泡圖直觀呈現產業資金的流入流出與加速進場狀態，一目了然漲潮與退潮區間。",
    "description": "視覺化資金輪動：透過板塊泡泡圖直觀呈現產業資金的流入流出與加速進場狀態，一目了然漲潮與退潮區間。 籌碼排行與勝率回測：提供法人買賣與「越跌越買」等多維度排行榜，並內建多空投票機制來累積與驗證個人看盤勝率。",
    "categories": [
      "strategy"
    ],
    "useCases": [
      "需要快速掌握盤面資金流向與產業輪動節奏的投資人。",
      "偏好跟隨法人籌碼趨勢進行佈局的波段交易者。"
    ],
    "markets": [],
    "assetClasses": [],
    "analysisTypes": [],
    "pricing": "unknown",
    "requiresLogin": "unknown",
    "language": [],
    "mobileSupport": "unknown",
    "dataSources": [],
    "updateFrequency": "unknown",
    "status": "pending-verification",
    "lastVerifiedAt": "2026-08-04",
    "verifiedBy": "PRStK Lab A03 baseline migration",
    "features": [
      "視覺化資金輪動：透過板塊泡泡圖直觀呈現產業資金的流入流出與加速進場狀態，一目了然漲潮與退潮區間。",
      "籌碼排行與勝率回測：提供法人買賣與「越跌越買」等多維度排行榜，並內建多空投票機制來累積與驗證個人看盤勝率。"
    ],
    "limitations": [
      "尚未完成逐項服務驗證，使用前請以外部服務最新說明為準。"
    ],
    "targetUsers": [
      "需要快速掌握盤面資金流向與產業輪動節奏的投資人。",
      "偏好跟隨法人籌碼趨勢進行佈局的波段交易者。"
    ],
    "tags": [
      "台股",
      "資金流",
      "產業輪動",
      "籌碼",
      "波段"
    ],
    "aliases": [
      "資金輪動",
      "板塊資金",
      "法人資金",
      "越跌越買"
    ],
    "url": "https://tide-tw.app/#",
    "screenshots": [],
    "relatedTools": [],
    "relatedResearch": [],
    "riskNotice": "外部服務內容可能延遲或變更，不構成投資建議。",
    "featured": false
  },
  {
    "id": "digital-garden",
    "slug": "digital-garden",
    "name": "🌱 數園智庫",
    "brandName": "DigitalGarden",
    "summary": "以數位花園串接投資觀點、研究框架與數據筆記，沉澱可持續迭代的個人知識網絡。",
    "description": "網狀知識網絡與策略沉澱：將碎片化的投資觀點、研究框架與數據筆記結構化串接，打造有機生長的個人投資知識庫。極簡模組化呈現：以現代數位花園架構呈現深度研究內容，便於回顧、驗證並迭代長期投資思維。",
    "categories": [
      "research"
    ],
    "useCases": [
      "體系化累積投資框架、重視思維複利的研究型投資人。",
      "想擺脫雜亂筆記、建立結構化市場洞察庫的自主學習者。"
    ],
    "markets": [
      "全球"
    ],
    "assetClasses": [
      "股票"
    ],
    "analysisTypes": [
      "基本面",
      "產業研究"
    ],
    "pricing": "unknown",
    "requiresLogin": "unknown",
    "language": [
      "中文"
    ],
    "mobileSupport": "unknown",
    "dataSources": [],
    "updateFrequency": "unknown",
    "status": "pending-verification",
    "lastVerifiedAt": "2026-08-28",
    "verifiedBy": "PRStK Lab catalog submission; service not independently verified",
    "features": [
      "將投資觀點、研究框架與數據筆記結構化串接成網狀知識網絡。",
      "以極簡模組化數位花園呈現研究內容，支援回顧、驗證與迭代。"
    ],
    "limitations": [
      "服務內容、資料更新與登入要求尚待 PRStK Lab 逐項驗證，使用前請以外部服務公告為準。"
    ],
    "targetUsers": [
      "偏好體系化累積投資框架、重視思維複利的研究型投資人。",
      "想擺脫雜亂筆記、建立專屬結構化市場洞察庫的自主學習者。"
    ],
    "tags": [
      "全球",
      "產業研究",
      "長期投資",
      "資產配置"
    ],
    "aliases": [
      "數園智庫",
      "Digital Garden",
      "投資知識庫",
      "研究筆記"
    ],
    "url": "https://digitalgarden-five-azure.vercel.app/",
    "screenshots": [],
    "relatedTools": [],
    "relatedResearch": [],
    "riskNotice": "外部服務內容可能延遲或變更，不構成投資建議。",
    "featured": false
  },
  {
    "id": "twrs-matrix",
    "slug": "twrs-matrix",
    "name": "🎯 台股強弱矩陣",
    "brandName": "TWRS Matrix",
    "summary": "以相對強度與族群輪動視角監控台股動能，快速辨識領跑大盤的強勢股與主流資金轉移。",
    "description": "相對強度（RS）動能監控：即時運算個股相對於大盤與族群的相對強弱度，快速識別領跑大盤的強勢股。產業族群輪動掃描：視覺化呈現板塊與概念股的強弱位階變化，掌握主流資金轉移軌跡。",
    "categories": [
      "strategy"
    ],
    "useCases": [
      "專注於順勢交易與動能策略的台股投資人。",
      "希望捕捉主流族群領漲股、避開弱勢落後標的的波段交易者。"
    ],
    "markets": [
      "台股"
    ],
    "assetClasses": [
      "股票"
    ],
    "analysisTypes": [
      "技術分析",
      "量化"
    ],
    "pricing": "unknown",
    "requiresLogin": "unknown",
    "language": [
      "中文"
    ],
    "mobileSupport": "unknown",
    "dataSources": [],
    "updateFrequency": "unknown",
    "status": "pending-verification",
    "lastVerifiedAt": "2026-08-28",
    "verifiedBy": "PRStK Lab catalog submission; service not independently verified",
    "features": [
      "即時運算個股相對於大盤與族群的相對強弱度，辨識強勢股。",
      "視覺化掃描產業族群輪動與概念股強弱位階變化。"
    ],
    "limitations": [
      "服務內容、資料更新與登入要求尚待 PRStK Lab 逐項驗證，使用前請以外部服務公告為準。"
    ],
    "targetUsers": [
      "專注於順勢交易與動能策略的台股投資人。",
      "希望捕捉主流族群領漲股、避開弱勢落後標的的波段交易者。"
    ],
    "tags": [
      "台股",
      "技術分析",
      "選股",
      "波段",
      "產業輪動"
    ],
    "aliases": [
      "TWRS",
      "強弱矩陣",
      "相對強度",
      "RS動能",
      "族群輪動"
    ],
    "url": "https://twrs.tw/",
    "screenshots": [],
    "relatedTools": [],
    "relatedResearch": [],
    "riskNotice": "外部服務內容可能延遲或變更，不構成投資建議。",
    "featured": false
  },
  {
    "id": "ais-cloud",
    "slug": "ais-cloud",
    "name": "🔮 智策極光",
    "brandName": "AIS Cloud",
    "summary": "以雲端 AI 運算整合多維度市場訊號，產出前瞻洞察與動態策略、風險評估參考。",
    "description": "雲端 AI 智慧決策運算：採用高擴展性雲端運算架構與機器學習模型，即時運算多維度市場訊號並產出前瞻洞察。動態策略與風險評估：結合多層次數據特徵萃取，生成投資輔助決策指標與動態風控建議。",
    "categories": [
      "risk"
    ],
    "useCases": [
      "追求前沿 AI 技術、希望以模型輔助日常決策的科技型投資人。",
      "需要雲端算力支撐、快速取得市場研判與風險評估的專業交易者。"
    ],
    "markets": [
      "全球"
    ],
    "assetClasses": [
      "股票"
    ],
    "analysisTypes": [
      "量化",
      "風控",
      "技術分析"
    ],
    "pricing": "unknown",
    "requiresLogin": "unknown",
    "language": [
      "中文"
    ],
    "mobileSupport": "unknown",
    "dataSources": [],
    "updateFrequency": "unknown",
    "status": "pending-verification",
    "lastVerifiedAt": "2026-08-28",
    "verifiedBy": "PRStK Lab catalog submission; service not independently verified",
    "features": [
      "以雲端 AI 與機器學習模型即時運算多維度市場訊號。",
      "結合特徵萃取產出動態策略與風險評估參考指標。"
    ],
    "limitations": [
      "服務內容、資料更新與登入要求尚待 PRStK Lab 逐項驗證，使用前請以外部服務公告為準。"
    ],
    "targetUsers": [
      "追求前沿 AI 技術、希望以模型輔助日常決策的科技型投資人。",
      "需要雲端算力支撐、快速取得市場研判與風險評估的專業交易者。"
    ],
    "tags": [
      "全球",
      "量化",
      "風控",
      "技術分析",
      "選股"
    ],
    "aliases": [
      "AIS Cloud",
      "智策極光",
      "雲端AI",
      "AI決策",
      "動態風控"
    ],
    "url": "https://ais-pre-gv4a6whhq7ghvlfzyhlyku-600298803862.asia-northeast1.run.app/",
    "screenshots": [],
    "relatedTools": [],
    "relatedResearch": [],
    "riskNotice": "外部服務內容可能延遲或變更，不構成投資建議。",
    "featured": false
  },
  {
    "id": "alpha-memo-ai",
    "slug": "alpha-memo-ai",
    "name": "🎙️ AI整理法說語音",
    "brandName": "AlphaMemo AI",
    "summary": "AI 音檔轉錄與重點摘要：自動將法說會語音轉換為精準逐字稿，並自動提煉關鍵內容生成結構化投資 Memo。",
    "description": "AI 音檔轉錄與重點摘要：自動將法說會語音轉換為精準逐字稿，並自動提煉關鍵內容生成結構化投資 Memo。 多語言支援與快捷導出：支援中英文等多國語言，可一鍵匯出 Markdown 格式，輕鬆對接 Notion 或 AI 知識庫。",
    "categories": [
      "research"
    ],
    "useCases": [
      "需要快速研讀法說會內容、精準撰寫個股研究報告的法人或研究員。",
      "習慣建立個人 AI 知識庫、希望高效獲取第一手市場資訊的自主投資人。"
    ],
    "markets": [],
    "assetClasses": [],
    "analysisTypes": [],
    "pricing": "unknown",
    "requiresLogin": "unknown",
    "language": [],
    "mobileSupport": "unknown",
    "dataSources": [],
    "updateFrequency": "unknown",
    "status": "pending-verification",